{
  "$schema": "https://agent-plugins.org/schemas/1.0.0/plugin.schema.json",
  "name": "apothem",
  "version": "1.5.0",
  "description": "Install and manage the Apothem shared profile — one source of truth for rules, slash-commands, skills, hooks, output-styles, settings, schemas, and MCP server definitions — across seventeen AI assistant harnesses, from Codex.",
  "author": {
    "name": "Ahmed G. Gad",
    "email": "me@ahmedgad.com",
    "url": "https://github.com/ahmed-g-gad"
  },
  "homepage": "https://apothem.ahmedgad.com/",
  "repository": "https://github.com/ahmed-g-gad/apothem",
  "license": "MIT",
  "keywords": ["apothem", "configuration-management", "developer-tools"]
}
